Original	LSTM_Sensitivity	BinaryS1ensitivity
356	this is a train wreck of an action film -- a stupefying attempt by the filmmakers to force-feed james bond into the mindless xxx mold and throw 40 years of cinematic history down the toilet in favor of bright flashes and loud bangs .  </s> 	1.52535866678873	0.783874199197532
357	this is a winning ensemble comedy that shows canadians can put gentle laughs and equally gentle sentiments on the button , just as easily as their counterparts anywhere else in the world .  </s> 	1.16341667770966	1.08814898633947
358	this is not the undisputed worst boxing movie ever , but it 's certainly not a champion - the big loser is the audience .  </s> 	1.67912431598516	0.938983728218061
359	this movie is maddening .  </s> 	1.87678693631017	1.97481051286173
360	this movie seems to have been written using mad-libs .  </s> 	1.71154399767712	1.83650643834384
361	this one is definitely one to skip , even for horror movie fanatics .  </s> 	2.07049243909775	2.71627106898431
362	this riveting world war ii moral suspense story deals with the shadow side of american culture : racial prejudice in its ugly and diverse forms .  </s> 	0.929740719233424	1.52487700005789
363	this tenth feature is a big deal , indeed -- at least the third-best , and maybe even a notch above the previous runner-up , nicholas meyer 's star trek vi : the undiscovered country .  </s> 	1.56964341302511	1.6853197315653
364	this time mr. burns is trying something in the martin scorsese street-realist mode , but his self-regarding sentimentality trips him up again .  </s> 	2.54452854130317	1.4972481495361
365	though it 's become almost redundant to say so , major kudos go to leigh for actually casting people who look working-class .  </s> 	1.97381833204634	1.95321338121786
366	though perry and hurley make inspiring efforts to breathe life into the disjointed , haphazard script by jay scherick and david ronn , neither the actors nor director reginald hudlin can make it more than fitfully entertaining .  </s> 	1.69026094544531	1.75209807555957
367	to call the other side of heaven `` appalling '' would be to underestimate just how dangerous entertainments like it can be .  </s> 	1.58117178096867	3.1055706253892
368	too much of it feels unfocused and underdeveloped .  </s> 	0.813467826530364	0.990853311771937
369	too often , the viewer is n't reacting to humor so much as they are wincing back in repugnance .  </s> 	2.04750310338228	1.28920976474411
370	to say this was done better in wilder 's some like it hot is like saying the sun rises in the east .  </s> 	1.35630512688461	4.07615960274508
371	tries to add some spice to its quirky sentiments but the taste is all too familiar .  </s> 	0.9089560905113	1.75224965051798
372	try as i may , i ca n't think of a single good reason to see this movie , even though everyone in my group extemporaneously shouted , ` thank you ! '  </s> 	1.49925687019129	2.84161059432612
373	turns potentially forgettable formula into something strangely diverting .  </s> 	1.92101036969027	2.40168733800832
374	... turns so unforgivably trite in its last 10 minutes that anyone without a fortified sweet tooth will likely go into sugar shock .  </s> 	1.57961372268214	1.41773608521781
375	uncommonly stylish but equally silly ... the picture fails to generate much suspense , nor does it ask searching enough questions to justify its pretensions .  </s> 	1.32761039220669	1.16406263025024
376	unflinchingly bleak and desperate  </s> 	0.961877495544411	1.16446397269472
377	unfortunately , it 's not silly fun unless you enjoy really bad movies .  </s> 	0.790940791725832	1.0399504824374
378	uses high comedy to evoke surprising poignance .  </s> 	0.983335048282584	0.970180143153332
379	uses sharp humor and insight into human nature to examine class conflict , adolescent yearning , the roots of friendship and sexual identity .  </s> 	0.899513559895429	0.948331329144346
380	utterly lacking in charm , wit and invention , roberto benigni 's pinocchio is an astonishingly bad film .  </s> 	0.908887558560298	0.901300501453405
381	warm water under a red bridge is a quirky and poignant japanese film that explores the fascinating connections between women , water , nature , and sexuality .  </s> 	0.818251870080558	1.29246691665002
382	we have n't seen such hilarity since say it is n't so !  </s> 	1.12209861248663	2.6493005663832
383	we know the plot 's a little crazy , but it held my interest from start to finish .  </s> 	2.26860685904126	1.69789970740734
384	we root for ( clara and paul ) , even like them , though perhaps it 's an emotion closer to pity .  </s> 	2.53900601250341	2.90009368579584
385	what better message than ` love thyself ' could young women of any size receive ?  </s> 	1.81063279176528	2.06206082626747
386	what distinguishes time of favor from countless other thrillers is its underlying concern with the consequences of words and with the complicated emotions fueling terrorist acts .  </s> 	1.597431704337	1.25394601363425
387	what really makes it special is that it pulls us into its world , gives us a hero whose suffering and triumphs we can share , surrounds him with interesting characters and sends us out of the theater feeling we 've shared a great adventure .  </s> 	0.860544484473671	0.847784521126629
388	what the director ca n't do is make either of val kilmer 's two personas interesting or worth caring about .  </s> 	1.783197381969	1.56264876577168
389	what the film lacks in general focus it makes up for in compassion , as corcuera manages to find the seeds of hope in the form of collective action .  </s> 	1.51573942936425	1.21975669089263
390	what was once original has been co-opted so frequently that it now seems pedestrian .  </s> 	1.83033946995574	1.12043358279865
391	when leguizamo finally plugged an irritating character late in the movie .  </s> 	1.55464591205273	2.47183011887916
392	whether writer-director anne fontaine 's film is a ghost story , an account of a nervous breakdown , a trip down memory lane , all three or none of the above , it is as seductive as it is haunting .  </s> 	2.08752061299897	1.29602222953394
393	whether you like rap music or loathe it , you ca n't deny either the tragic loss of two young men in the prime of their talent or the power of this movie .  </s> 	1.48619058828251	2.1661165479284
394	while ( hill ) has learned new tricks , the tricks alone are not enough to salvage this lifeless boxing film .  </s> 	1.43895451325703	0.91136486754151
395	( w ) hile long on amiable monkeys and worthy environmentalism , jane goodall 's wild chimpanzees is short on the thrills the oversize medium demands .  </s> 	3.33283909468387	2.70070838864024
396	while the resident evil games may have set new standards for thrills , suspense , and gore for video games , the movie really only succeeds in the third of these .  </s> 	1.42528678110553	1.61883818401665
397	while there 's something intrinsically funny about sir anthony hopkins saying ` get in the car , bitch , ' this jerry bruckheimer production has little else to offer  </s> 	1.34018872806428	1.53564512701708
398	why make a documentary about these marginal historical figures ?  </s> 	1.09827295581945	1.25569723715738
399	without ever becoming didactic , director carlos carrera expertly weaves this novelistic story of entangled interrelationships and complex morality .  </s> 	1.2825945612936	0.965852332087631
400	... with `` the bourne identity '' we return to the more traditional action genre .  </s> 	1.7353806336821	3.5974352604173
401	with the exception of some fleetingly amusing improvisations by cedric the entertainer as perry 's boss , there is n't a redeeming moment here .  </s> 	2.53103370007268	1.19083377313602
402	with tightly organized efficiency , numerous flashbacks and a constant edge of tension , miller 's film is one of 2002 's involvingly adult surprises .  </s> 	1.37621271648614	1.4196575864567
403	with virtually no interesting elements for an audience to focus on , chelsea walls is a triple-espresso endurance challenge .  </s> 	0.772807092122034	1.87135729565444
404	works hard to establish rounded characters , but then has nothing fresh or particularly interesting to say about them .  </s> 	1.67038188766263	1.26931806929275
405	you do n't have to know about music to appreciate the film 's easygoing blend of comedy and romance .  </s> 	1.43390790158863	1.65694844808157
406	you 'll gasp appalled and laugh outraged and possibly , watching the spectacle of a promising young lad treading desperately in a nasty sea , shed an errant tear .  </s> 	1.13391913861095	2.31692187766567
407	you wonder why enough was n't just a music video rather than a full-length movie .  </s> 	1.34358361245516	1.85089874451828
408	you wo n't like roger , but you will quickly recognize him .  </s> 	1.71484512410928	3.69838732850614
409	zhang ... has done an amazing job of getting realistic performances from his mainly nonprofessional cast .  </s> 	2.08643339025881	1.68258618024823
