Original	LSTM_Sensitivity	BinaryS1ensitivity
1	a beguiling splash of pastel colors and prankish comedy from disney .  </s> 	1.29900532074242	1.41175600394878
2	a big , gorgeous , sprawling swashbuckler that delivers its diversions in grand , uncomplicated fashion .  </s> 	1.04770765724642	1.45147076835514
3	... a boring parade of talking heads and technical gibberish that will do little to advance the linux cause .  </s> 	1.71676827759651	1.20704782632977
4	about a manga-like heroine who fights back at her abusers , it 's energetic and satisfying if not deep and psychological .  </s> 	1.04113981368272	1.59303113029365
5	a by-the-numbers effort that wo n't do much to enhance the franchise .  </s> 	1.19082907444154	1.76890588312064
6	a celebration of quirkiness , eccentricity , and certain individuals ' tendency to let it all hang out , and damn the consequences .  </s> 	1.58050695185681	2.19752530381589
7	a coda in every sense , the pinochet case splits time between a minute-by-minute account of the british court 's extradition chess game and the regime 's talking-head survivors .  </s> 	1.37084593555237	4.52937169951088
8	a deep and meaningful film .  </s> 	1.28587118668571	1.05545242827956
9	a densely constructed , highly referential film , and an audacious return to form that can comfortably sit among jean-luc godard 's finest work .  </s> 	1.29726687715052	1.32442709448772
10	a difficult , absorbing film that manages to convey more substance despite its repetitions and inconsistencies than do most films than are far more pointed and clear .  </s> 	2.51322253148083	1.68995307617347
11	a dumb movie with dumb characters doing dumb things and you have to be really dumb not to see where this is going .  </s> 	1.0936209646739	1.01265880339408
12	a fast , funny , highly enjoyable movie .  </s> 	0.850761549244779	1.22259093781228
13	affleck and jackson are good sparring partners .  </s> 	1.57403665414859	1.69034529862782
14	a full world has been presented onscreen , not some series of carefully structured plot points building to a pat resolution .  </s> 	2.3558557934877	2.34805910753358
15	a giggle a minute .  </s> 	1.11894871932148	1.66447462839167
16	a gorgeous , high-spirited musical from india that exquisitely blends music , dance , song , and high drama .  </s> 	0.751584302755933	0.955691379034969
17	a gorgeous , witty , seductive movie .  </s> 	0.853562298424155	0.930553704783532
18	a great ensemble cast ca n't lift this heartfelt enterprise out of the familiar .  </s> 	1.62452235886746	3.84872697872161
19	a gripping movie , played with performances that are all understated and touching .  </s> 	0.871029978674207	1.32377039893901
20	... a hollow joke told by a cinematic gymnast having too much fun embellishing the misanthropic tale to actually engage it .  </s> 	1.41237283272973	1.24946017372926
21	all-in-all , the film is an enjoyable and frankly told tale of a people who live among us , but not necessarily with us .  </s> 	2.01946244367604	1.61886201471449
22	allows us to hope that nolan is poised to embark a major career as a commercial yet inventive filmmaker .  </s> 	0.857325489299745	1.76381984548261
23	all that 's missing is the spontaneity , originality and delight .  </s> 	1.66432219949949	1.68584984442318
24	although laced with humor and a few fanciful touches , the film is a refreshingly serious look at young women .  </s> 	1.20362058231018	1.56349811349399
25	altogether , this is successful as a film , while at the same time being a most touching reconsideration of the familiar masterpiece .  </s> 	2.74518482403474	1.78790056190777
26	a misogynistic piece of filth that attempts to pass itself off as hip , young adult entertainment .  </s> 	3.00350747066365	1.51908353309147
27	among the year 's most intriguing explorations of alientation .  </s> 	1.4818990330453	1.22732832127095
28	a movie that reminds us of just how exciting and satisfying the fantasy cinema can be when it 's approached with imagination and flair .  </s> 	1.14012987156957	1.27887777882988
29	a must-see for the david mamet enthusiast and for anyone who appreciates intelligent , stylish moviemaking .  </s> 	0.901278819943485	1.22903388206619
30	an artful , intelligent film that stays within the confines of a well-established genre .  </s> 	0.808670432074982	1.2046317607277
31	and that leaves a hole in the center of the salton sea .  </s> 	2.05410242225623	1.82121552167879
32	and the lesson , in the end , is nothing new .  </s> 	2.226865048262	2.23233149972849
33	an entertaining , colorful , action-filled crime story with an intimate heart .  </s> 	0.751627043966745	1.02219325905315
34	a nightmare date with a half-formed wit done a great disservice by a lack of critical distance and a sad trust in liberal arts college bumper sticker platitudes .  </s> 	1.09440773029477	1.11335524654327
35	an intriguing cinematic omnibus and round-robin that occasionally is more interesting in concept than in execution .  </s> 	1.74799781240333	1.84379563362015
36	an occasionally funny , but overall limp , fish-out-of-water story .  </s> 	2.34139339581489	1.43655506623114
37	an operatic , sprawling picture that 's entertainingly acted , magnificently shot and gripping enough to sustain most of its 170-minute length .  </s> 	1.79453969609226	1.61763059101785
38	another in-your-face wallow in the lower depths made by people who have never sung those blues .  </s> 	2.54341540364114	1.87985084530495
39	an overemphatic , would-be wacky , ultimately tedious sex farce .  </s> 	3.0546197267086	1.75062568825129
40	an unwise amalgam of broadcast news and vibes .  </s> 	1.48466856720374	1.29648125310586
41	a painfully funny ode to bad behavior .  </s> 	0.937690201434479	1.78307667229557
42	a pleasant enough romance with intellectual underpinnings , the kind of movie that entertains even as it turns maddeningly predictable .  </s> 	0.886885445110661	2.11328814026201
43	a psychological thriller with a genuinely spooky premise and an above-average cast , actor bill paxton 's directing debut is a creepy slice of gothic rural americana .  </s> 	1.26027482699957	1.92825468693156
44	a rarity among recent iranian films : it 's a comedy full of gentle humor that chides the absurdity of its protagonist 's plight .  </s> 	0.852926008247948	1.62548414510517
45	a rewarding work of art for only the most patient and challenge-hungry moviegoers .  </s> 	0.843885976223936	1.50854918961811
46	as a first-time director , paxton has tapped something in himself as an actor that provides frailty with its dark soul .  </s> 	1.57786936216443	1.47040775941407
47	a sequence of ridiculous shoot - 'em - up scenes .  </s> 	1.71145931331646	2.27430578811765
48	a solid examination of the male midlife crisis .  </s> 	0.852321202825862	1.32920688690616
49	a solid film ... but more conscientious than it is truly stirring .  </s> 	0.89641646945622	1.54049918569624
50	a sometimes tedious film .  </s> 	1.34051789088615	1.2978645784337
51	as surreal as a dream and as detailed as a photograph , as visually dexterous as it is at times imaginatively overwhelming .  </s> 	1.3890798543036	1.45723883270434
52	as the two leads , lathan and diggs are charming and have chemistry both as friends and lovers .  </s> 	1.37667869994792	1.25831143380654
53	a string of rehashed sight gags based in insipid vulgarity .  </s> 	2.37382802499382	1.1968353446917
54	a subtle and well-crafted ( for the most part ) chiller .  </s> 	0.852549923873524	1.54587561594768
55	as unseemly as its title suggests .  </s> 	1.72184339902817	1.30728598373065
56	as vulgar as it is banal .  </s> 	0.862512840488977	1.31345677664378
57	a swashbuckling tale of love , betrayal , revenge and above all , faith .  </s> 	1.78714906552941	1.63491532518057
58	a synthesis of cliches and absurdities that seems positively decadent in its cinematic flash and emptiness .  </s> 	1.29083372237613	2.32731947656957
59	a tender , heartfelt family drama .  </s> 	0.942122102707475	1.37373526308185
60	at its best , queen is campy fun like the vincent price horror classics of the '60s .  </s> 	1.82870320864327	1.85827203509775
61	at its worst , it implodes in a series of very bad special effects .  </s> 	0.885366287301872	0.953284770468858
62	at least one scene is so disgusting that viewers may be hard pressed to retain their lunch .  </s> 	1.60934125734074	1.44260626759656
63	attempts by this ensemble film to impart a message are so heavy-handed that they instead pummel the audience .  </s> 	1.58084221637652	0.960904814178345
64	at the very least , if you do n't know anything about derrida when you walk into the theater , you wo n't know much more when you leave .  </s> 	1.86700460603535	3.14043550288094
65	at times , the suspense is palpable , but by the end there 's a sense that the crux of the mystery hinges on a technicality that strains credulity and leaves the viewer haunted by the waste of potential .  </s> 	1.91194022372543	2.00494398913043
66	audrey tatou has a knack for picking roles that magnify her outrageous charm , and in this literate french comedy , she 's as morning-glory exuberant as she was in amélie .  </s> 	1.60262850521097	1.35469315331397
67	a very long movie , dull in stretches , with entirely too much focus on meal preparation and igloo construction .  </s> 	2.12130924230437	1.5483849977797
68	a very well-made , funny and entertaining picture .  </s> 	1.26918511355092	0.927487727357286
69	a warm but realistic meditation on friendship , family and affection .  </s> 	0.919820100121237	1.13358549409775
70	a warm , funny , engaging film .  </s> 	1.00572294298161	1.16840192977094
71	awesome creatures , breathtaking scenery , and epic battle scenes add up to another ` spectacular spectacle . '  </s> 	0.849680283366919	1.48072366273406
72	a woman 's pic directed with resonance by ilya chaiken .  </s> 	1.43117848529931	1.96219404513269
73	bad .  </s> 	0.648669782183927	0.824962358364114
74	basically a static series of semi-improvised ( and semi-coherent ) raps between the stars .  </s> 	0.866207147048739	1.59967324475637
75	blanchett 's performance confirms her power once again .  </s> 	0.866867458848496	1.65905839391151
76	bleakly funny , its characters all the more touching for refusing to pity or memorialize themselves .  </s> 	1.79303878610647	1.45379292259751
77	brilliantly explores the conflict between following one 's heart and following the demands of tradition .  </s> 	0.741516658933886	0.970319011234729
78	broomfield turns his distinctive ` blundering ' style into something that could really help clear up the case .  </s> 	1.95043003389505	2.45502426204934
79	/ but daphne , you 're too buff / fred thinks he 's tough / and velma - wow , you 've lost weight !  </s> 	1.59499393420146	3.22036188230855
80	but it could have been worse .  </s> 	1.28623001710529	1.25266375458118
81	by getting myself wrapped up in the visuals and eccentricities of many of the characters , i found myself confused when it came time to get to the heart of the movie .  </s> 	1.57787066981337	2.18280147557738
82	byler reveals his characters in a way that intrigues and even fascinates us , and he never reduces the situation to simple melodrama .  </s> 	1.11894830668872	1.32154827435009
83	characters still need to function according to some set of believable and comprehensible impulses , no matter how many drugs they do or how much artistic license avary employs .  </s> 	1.76587422287538	2.3981408804644
84	chilling , well-acted , and finely directed : david jacobson 's dahmer .  </s> 	0.872488648002104	1.24094578224955
85	chokes on its own depiction of upper-crust decorum .  </s> 	2.39170013908366	0.997943229712406
86	combining quick-cut editing and a blaring heavy metal much of the time , beck seems to be under the illusion that he 's shooting the latest system of a down video .  </s> 	1.8524449835079	2.60323270542824
87	comes ... uncomfortably close to coasting in the treads of the bicycle thief .  </s> 	2.0345571168386	2.16871217088224
88	complete lack of originality , cleverness or even visible effort  </s> 	0.740200109518289	0.968441104578766
89	confirms the nagging suspicion that ethan hawke would be even worse behind the camera than he is in front of it .  </s> 	0.996511679644875	1.8637002126907
90	corny , schmaltzy and predictable , but still manages to be kind of heartwarming , nonetheless .  </s> 	1.74247694359196	1.92160655235585
91	dazzles with its fully-written characters , its determined stylishness ( which always relates to characters and story ) and johnny dankworth 's best soundtrack in years .  </s> 	1.45066572108312	1.00566510036649
92	delivers the same old same old , tarted up with latin flava and turned out by hollywood playas .  </s> 	1.79902533403079	2.93595668250749
93	` de niro ... is a veritable source of sincere passion that this hollywood contrivance orbits around . '  </s> 	2.60688063689138	3.35446621789197
94	dense with characters and contains some thrilling moments .  </s> 	1.74930524994172	1.26847268596029
95	... designed to provide a mix of smiles and tears , `` crossroads '' instead provokes a handful of unintentional howlers and numerous yawns .  </s> 	1.0358241952326	1.20505213961942
96	despite its title , punch-drunk love is never heavy-handed .  </s> 	1.61599253854571	1.67244984266107
97	despite the 2-d animation , the wild thornberrys movie makes for a surprisingly cinematic experience .  </s> 	1.52399435838487	1.5409313487208
98	determined to be fun , and bouncy , with energetic musicals , the humor did n't quite engage this adult .  </s> 	1.05061369735607	2.44873087509416
99	directed in a paint-by-numbers manner .  </s> 	1.39788792930914	1.58363130680224
100	director andrew niccol ... demonstrates a wry understanding of the quirks of fame .  </s> 	1.68650019243288	1.55787612968236
101	displaying about equal amounts of naiveté , passion and talent , beneath clouds establishes sen as a filmmaker of considerable potential .  </s> 	0.953511045738409	1.3073963485878
102	( d ) oes n't bother being as cloying or preachy as equivalent evangelical christian movies -- maybe the filmmakers know that the likely audience will already be among the faithful .  </s> 	2.15630337733198	4.8032649865739
103	does n't offer much besides glib soullessness , raunchy language and a series of brutal set pieces ... that raise the bar on stylized screen violence .  </s> 	1.19459635448806	2.10939624620298
104	does paint some memorable images ... , but makhmalbaf keeps her distance from the characters  </s> 	1.22535494140235	2.48663464837738
105	` easily my choice for one of the year 's best films . '  </s> 	1.94591895346256	2.46697592775844
106	entertains by providing good , lively company .  </s> 	1.76681221313779	1.2141673866585
107	escaping the studio , piccoli is warmly affecting and so is this adroitly minimalist movie .  </s> 	1.73338838192136	1.86577883983004
108	even horror fans will most likely not find what they 're seeking with trouble every day ; the movie lacks both thrills and humor .  </s> 	1.85597834906383	1.71235387209648
109	every nanosecond of the the new guy reminds you that you could be doing something else far more pleasurable .  </s> 	1.74871419741871	3.08534237554277
110	exquisitely nuanced in mood tics and dialogue , this chamber drama is superbly acted by the deeply appealing veteran bouquet and the chilling but quite human berling .  </s> 	0.927553132426978	0.993910714757311
111	falls neatly into the category of good stupid fun .  </s> 	1.28594883252906	2.56228454703951
112	far more imaginative and ambitious than the trivial , cash-in features nickelodeon has made from its other animated tv series .  </s> 	0.796467456786808	1.94664774205873
113	feels haphazard , as if the writers mistakenly thought they could achieve an air of frantic spontaneity by simply tossing in lots of characters doing silly stuff and stirring the pot .  </s> 	0.953086526978016	1.33166256885801
114	feels too formulaic and too familiar to produce the transgressive thrills of early underground work .  </s> 	1.24913171197001	1.40303573878491
115	for all its impressive craftsmanship , and despite an overbearing series of third-act crescendos , lily chou-chou never really builds up a head of emotional steam .  </s> 	2.50995035982831	3.2042606697776
116	forced , familiar and thoroughly condescending .  </s> 	1.2511792024413	2.12502515354459
117	for movie lovers as well as opera lovers , tosca is a real treat .  </s> 	1.0896488650557	1.51427708218827
118	for starters , the story is just too slim .  </s> 	1.50295804288993	1.78919495871147
119	for the most part , director anne-sophie birot 's first feature is a sensitive , extraordinarily well-acted drama .  </s> 	1.81550977699568	1.30727424801051
120	for the most part , it 's a work of incendiary genius , steering clear of knee-jerk reactions and quick solutions .  </s> 	2.79881062210602	2.08450697161863
121	for this reason and this reason only -- the power of its own steadfast , hoity-toity convictions -- chelsea walls deserves a medal .  </s> 	1.4016015737418	2.47448927767766
122	fresnadillo 's dark and jolting images have a way of plying into your subconscious like the nightmare you had a week ago that wo n't go away .  </s> 	1.83948189199247	2.14201326624721
123	fun , flip and terribly hip bit of cinematic entertainment .  </s> 	1.32913905658766	1.11981329212991
124	good old-fashioned slash-and-hack is back !  </s> 	0.905028348941931	1.62905141477231
125	green might want to hang onto that ski mask , as robbery may be the only way to pay for his next project .  </s> 	1.52029847642507	1.35883732272774
126	hardly a masterpiece , but it introduces viewers to a good charitable enterprise and some interesting real people .  </s> 	1.23297355364901	2.14385472755631
127	has a lot of the virtues of eastwood at his best .  </s> 	1.40526927121418	1.81109759108577
128	having had the good sense to cast actors who are , generally speaking , adored by the movie-going public , khouri then gets terrific performances from them all .  </s> 	1.27379632211586	1.69445832718317
129	hilariously inept and ridiculous .  </s> 	1.42916623059181	1.30714363156275
130	his comedy premises are often hackneyed or just plain crude , calculated to provoke shocked laughter , without following up on a deeper level .  </s> 	1.4084290702971	2.16169126994845
131	his last movie was poetically romantic and full of indelible images , but his latest has nothing going for it .  </s> 	1.9139792146726	1.91308443139692
132	hit and miss as far as the comedy goes and a big ole ' miss in the way of story .  </s> 	2.08154178947657	1.37953637008731
133	holden caulfield did it better .  </s> 	1.00886567178184	2.7762564810182
134	holm ... embodies the character with an effortlessly regal charisma .  </s> 	1.18414775979925	1.36982633643743
135	however it may please those who love movies that blare with pop songs , young science fiction fans will stomp away in disgust .  </s> 	2.13947097462069	1.62305887814577
136	huston nails both the glad-handing and the choking sense of hollow despair .  </s> 	1.53139813714898	1.68494672797064
137	i 'd have to say the star and director are the big problems here .  </s> 	1.74311987599899	2.12922759475258
138	i do n't mind having my heartstrings pulled , but do n't treat me like a fool .  </s> 	1.78774623428346	4.38193175851725
139	if director michael dowse only superficially understands his characters , he does n't hold them in contempt .  </s> 	1.83019087158005	4.21226181038313
140	if steven soderbergh 's ` solaris ' is a failure it is a glorious failure .  </s> 	1.43651951397074	1.37762879870948
141	if the movie succeeds in instilling a wary sense of ` there but for the grace of god , ' it is far too self-conscious to draw you deeply into its world .  </s> 	1.06779059702443	1.57588015711964
142	if you believe any of this , i can make you a real deal on leftover enron stock that will double in value a week from friday .  </s> 	1.63288515195361	2.7467287973134
143	if you can stomach the rough content , it 's worth checking out for the performances alone .  </s> 	1.66849110634057	2.20972760621826
144	if you dig on david mamet 's mind tricks ... rent this movie and enjoy !  </s> 	1.5486349008557	1.44068695052116
145	if you enjoy more thoughtful comedies with interesting conflicted characters ; this one is for you .  </s> 	0.91449854622707	2.60891281528343
146	if you 're hard up for raunchy college humor , this is your ticket right here .  </s> 	1.96337523866132	2.29266211490154
147	i had to look away - this was god awful .  </s> 	1.75463638840976	1.50207649241794
148	i 'll bet the video game is a lot more fun than the film .  </s> 	2.16243665450801	3.38398849221401
149	i 'm just too bored to care .  </s> 	1.30661683254089	1.21155686844323
150	in an effort , i suspect , not to offend by appearing either too serious or too lighthearted , it offends by just being wishy-washy .  </s> 	1.72249537866232	1.57571317272501
151	in exactly 89 minutes , most of which passed as slowly as if i 'd been sitting naked on an igloo , formula 51 sank from quirky to jerky to utter turkey .  </s> 	1.30901698466752	0.992571233452864
152	in execution , this clever idea is far less funny than the original , killers from space .  </s> 	2.54798609657947	2.34311943491395
153	in its best moments , resembles a bad high school production of grease , without benefit of song .  </s> 	1.91637606037608	1.15787937216448
154	inside the film 's conflict-powered plot there is a decent moral trying to get out , but it 's not that , it 's the tension that keeps you in your seat .  </s> 	1.06408049650504	3.05053018685336
155	instead of a hyperbolic beat-charged urban western , it 's an unpretentious , sociologically pointed slice of life .  </s> 	2.37374227863775	1.50406943765726
156	instead of hiding pinocchio from critics , miramax should have hidden it from everyone .  </s> 	0.7840489211151	1.66452778509149
157	in the end , we are left with something like two ships passing in the night rather than any insights into gay love , chinese society or the price one pays for being dishonest .  </s> 	2.129699088677	1.81826646907782
158	i sympathize with the plight of these families , but the movie does n't do a very good job conveying the issue at hand .  </s> 	1.87569583306015	1.79423844125356
159	it all adds up to good fun .  </s> 	0.892389537083503	1.39482501714698
160	it all drags on so interminably it 's like watching a miserable relationship unfold in real time .  </s> 	1.04293900763369	1.11002155231113
161	it all feels like a monty python sketch gone horribly wrong .  </s> 	1.07053934217831	1.37816044145353
162	it appears that something has been lost in the translation to the screen .  </s> 	0.808793357670198	1.47635434203561
163	it ca n't decide if it wants to be a mystery/thriller , a romance or a comedy .  </s> 	1.79316164596465	1.3772941838439
164	it deserves to be seen by anyone with even a passing interest in the events shaping the world beyond their own horizons .  </s> 	1.47689481990163	2.83296937089446
165	it does n't believe in itself , it has no sense of humor ... it 's just plain bored .  </s> 	1.21749185147014	1.0339316639578
166	it feels like an after-school special gussied up with some fancy special effects , and watching its rote plot points connect is about as exciting as gazing at an egg timer for 93 minutes .  </s> 	1.04519593815901	0.995920181710167
167	it has charm to spare , and unlike many romantic comedies , it does not alienate either gender in the audience .  </s> 	1.37257143713244	1.06000764609822
168	it haunts you , you ca n't forget it , you admire its conception and are able to resolve some of the confusions you had while watching it .  </s> 	1.64682416876667	1.24649333596174
169	it is great summer fun to watch arnold and his buddy gerald bounce off a quirky cast of characters .  </s> 	0.861602895239557	1.1707382020615
170	it just may inspire a few younger moviegoers to read stevenson 's book , which is a treasure in and of itself .  </s> 	2.33907361560387	2.32584600621344
171	it made me want to wrench my eyes out of my head and toss them at the screen .  </s> 	2.57921301780053	1.35452064266403
172	it moves quickly , adroitly , and without fuss ; it does n't give you time to reflect on the inanity -- and the cold war datedness -- of its premise .  </s> 	2.089257434368	2.00013241982354
173	it offers little beyond the momentary joys of pretty and weightless intellectual entertainment .  </s> 	1.2214294745457	1.27659146128548
174	it proves quite compelling as an intense , brooding character study .  </s> 	1.73928853378054	1.40311178021744
175	it provides an honest look at a community striving to anchor itself in new grounds .  </s> 	1.09626865253965	1.21912319595323
176	it provides the grand , intelligent entertainment of a superior cast playing smart people amid a compelling plot .  </s> 	0.884636080489358	1.41124792988033
177	it 's a bad thing when a movie has about as much substance as its end credits blooper reel .  </s> 	1.26267400193574	1.31009085229361
178	it 's a charming and often affecting journey .  </s> 	1.12130801251505	1.30001178383296
179	it 's a cookie-cutter movie , a cut-and-paste job .  </s> 	1.81300193375598	1.70790095131141
180	it 's a grab bag of genres that do n't add up to a whole lot of sense .  </s> 	1.53110845057586	2.76158503870534
181	it 's also , clearly , great fun .  </s> 	1.32747720087348	1.70732395256199
182	it 's an offbeat treat that pokes fun at the democratic exercise while also examining its significance for those who take part .  </s> 	1.16984636534679	1.28584128623939
183	it 's another stale , kill-by-numbers flick , complete with blade-thin characters and terrible , pun-laden dialogue .  </s> 	1.13212192424418	1.26659241156889
184	it 's a remarkably solid and subtly satirical tour de force .  </s> 	0.852428820143175	1.64446544159098
