Original	LSTM_Sensitivity	BinaryS1ensitivity
185	it 's a scattershot affair , but when it hits its mark it 's brilliant .  </s> 	2.78785246553501	1.59698445192453
186	it 's a work by an artist so in control of both his medium and his message that he can improvise like a jazzman .  </s> 	3.10204658326149	1.82373497192199
187	it 's difficult to imagine the process that produced such a script , but here 's guessing that spray cheese and underarm noises played a crucial role .  </s> 	2.74509655731211	4.51120527602754
188	it seems like i have been waiting my whole life for this movie and now i ca n't wait for the sequel .  </s> 	1.38674405539121	4.31626195615467
189	it seems to me the film is about the art of ripping people off without ever letting them consciously know you have done so  </s> 	2.19594349891097	3.2800099390525
190	it 's great escapist fun that recreates a place and time that will never happen again .  </s> 	1.22808263040121	1.56547443352207
191	it 's hampered by a lifetime-channel kind of plot and a lead actress who is out of her depth .  </s> 	1.51743810939876	1.41762369501266
192	it 's hard to like a film about a guy who is utterly unlikeable , and shiner , starring michael caine as an aging british boxing promoter desperate for a taste of fame and fortune , is certainly that .  </s> 	2.43626406666001	4.59288602652176
193	it 's just disappointingly superficial -- a movie that has all the elements necessary to be a fascinating , involving character study , but never does more than scratch the surface .  </s> 	1.45132656384595	1.43765372656028
194	it 's like every bad idea that 's ever gone into an after-school special compiled in one place , minus those daytime programs ' slickness and sophistication ( and who knew they even had any ? ) .  </s> 	0.833622226186319	1.32228700813898
195	it 's like watching a nightmare made flesh .  </s> 	1.34468216646195	2.5247150297413
196	it 's not that kung pow is n't funny some of the time -- it just is n't any funnier than bad martial arts movies are all by themselves , without all oedekerk 's impish augmentation .  </s> 	1.1878631314026	1.76573978083717
197	it 's not the ultimate depression-era gangster movie .  </s> 	2.21193728998753	2.27432898950145
198	it 's of the quality of a lesser harrison ford movie - six days , seven nights , maybe , or that dreadful sabrina remake .  </s> 	1.82581199688047	2.19641650977583
199	it 's one heck of a character study -- not of hearst or davies but of the unique relationship between them .  </s> 	1.24464651954725	1.75721009386763
200	it 's one of those baseball pictures where the hero is stoic , the wife is patient , the kids are as cute as all get-out and the odds against success are long enough to intimidate , but short enough to make a dream seem possible .  </s> 	2.13355855689633	2.27204650080902
201	it 's one pussy-ass world when even killer-thrillers revolve around group therapy sessions .  </s> 	2.56556573677345	1.51895610217032
202	it 's played in the most straight-faced fashion , with little humor to lighten things up .  </s> 	1.97175492604547	3.71312673298651
203	it 's refreshing to see a girl-power movie that does n't feel it has to prove anything .  </s> 	1.36367881526609	1.37624135385839
204	it 's slow -- very , very slow .  </s> 	1.51924265188774	1.77208149469113
205	it 's so good that its relentless , polished wit can withstand not only inept school productions , but even oliver parker 's movie adaptation .  </s> 	3.0035672195243	1.46072064545923
206	its story may be a thousand years old , but why did it have to seem like it took another thousand to tell it to us ?  </s> 	1.30565306454955	1.33045875432228
207	it 's the chemistry between the women and the droll scene-stealing wit and wolfish pessimism of anna chancellor that makes this `` two weddings and a funeral '' fun .  </s> 	1.72395789607932	1.4689409449636
208	it 's worth seeing just on the basis of the wisdom , and at times , the startling optimism , of the children .  </s> 	0.953869327173191	1.24033677027823
209	it takes a strange kind of laziness to waste the talents of robert forster , anne meara , eugene levy , and reginald veljohnson all in the same movie .  </s> 	1.36516092064168	1.61198795217113
210	it takes talent to make a lifeless movie about the most heinous man who ever lived .  </s> 	1.87482159884971	1.39932300340394
211	jaglom ... put ( s ) the audience in the privileged position of eavesdropping on his characters  </s> 	2.02467593006091	4.20660736703284
212	jason x is positively anti-darwinian : nine sequels and 400 years later , the teens are none the wiser and jason still kills on auto-pilot .  </s> 	1.97648465428441	2.98116557463863
213	just one bad idea after another .  </s> 	0.844597822119652	1.41842074033133
214	k-19 exploits our substantial collective fear of nuclear holocaust to generate cheap hollywood tension .  </s> 	1.90289966423303	1.77873190407423
215	( lawrence bounces ) all over the stage , dancing , running , sweating , mopping his face and generally displaying the wacky talent that brought him fame in the first place .  </s> 	1.24691194540575	3.87199831858909
216	leigh 's film is full of memorable performances from top to bottom .  </s> 	1.04916320970364	2.35020526752571
217	like leon , it 's frustrating and still oddly likable .  </s> 	1.87192061203294	2.56635379519709
218	liotta put on 30 pounds for the role , and has completely transformed himself from his smooth , goodfellas image .  </s> 	2.13199612152401	2.78903688037032
219	looks and feels like a project better suited for the small screen .  </s> 	1.24401706538559	2.35058885778165
220	macdowell , whose wifty southern charm has anchored lighter affairs ... brings an absolutely riveting conviction to her role .  </s> 	0.802171773916176	1.79152107611406
221	manages to be both repulsively sadistic and mundane .  </s> 	1.95253289688319	2.00392296901909
222	manages to be sweet and wickedly satisfying at the same time .  </s> 	1.19016730822367	1.17807692069481
223	manages to transcend the sex , drugs and show-tunes plot into something far richer .  </s> 	1.13302229427947	1.20009400237659
224	martin and barbara are complex characters -- sometimes tender , sometimes angry -- and the delicate performances by sven wollter and viveka seldahl make their hopes and frustrations vivid .  </s> 	0.938405208760954	1.30071138771892
225	mattei is tiresomely grave and long-winded , as if circularity itself indicated profundity .  </s> 	1.26022789795606	1.59331314886995
226	maud and roland 's search for an unknowable past makes for a haunting literary detective story , but labute pulls off a neater trick in possession : he makes language sexy .  </s> 	1.86126014230014	1.80138891665212
227	may reawaken discussion of the kennedy assassination but this fictional film looks made for cable rather than for the big screen .  </s> 	1.31442798638427	2.03181683624819
228	minority report is exactly what the title indicates , a report .  </s> 	1.57300929983097	3.73450624770356
229	montias ... pumps a lot of energy into his nicely nuanced narrative and surrounds himself with a cast of quirky -- but not stereotyped -- street characters .  </s> 	1.76870414637557	1.08202011709664
230	moody , heartbreaking , and filmed in a natural , unforced style that makes its characters seem entirely convincing even when its script is not .  </s> 	1.84162062598253	1.11068797933842
231	more whiny downer than corruscating commentary .  </s> 	0.71159810434742	1.26908425670914
232	morton uses her face and her body language to bring us morvern 's soul , even though the character is almost completely deadpan .  </s> 	0.870538234963969	2.1182972665758
233	mr. tsai is a very original artist in his medium , and what time is it there ?  </s> 	1.38462452244446	2.90552360173196
234	my reaction in a word : disappointment .  </s> 	1.37256065245134	1.40703957217109
235	my thoughts were focused on the characters .  </s> 	1.6761467711321	3.0503047739743
236	( næs ) directed the stage version of elling , and gets fine performances from his two leads who originated the characters on stage .  </s> 	1.82396704592819	1.8602565111067
237	neither parker nor donovan is a typical romantic lead , but they bring a fresh , quirky charm to the formula .  </s> 	0.763355800862934	1.38830678293353
238	nicks , seemingly uncertain what 's going to make people laugh , runs the gamut from stale parody to raunchy sex gags to formula romantic comedy .  </s> 	1.63308385967499	3.00545097717112
239	no one but a convict guilty of some truly heinous crime should have to sit through the master of disguise .  </s> 	1.37910449222222	1.68420987532114
240	no sophomore slump for director sam mendes , who segues from oscar winner to oscar-winning potential with a smooth sleight of hand .  </s> 	0.986960037420997	1.2328273290302
241	not exactly the bees knees  </s> 	1.09444673987424	1.17609741505746
242	nothing is sacred in this gut-buster .  </s> 	1.34530274616137	2.22857658751719
243	nothing 's at stake , just a twisty double-cross you can smell a mile away -- still , the derivative nine queens is lots of fun .  </s> 	1.79519896965537	2.68951805198101
244	not only is undercover brother as funny , if not more so , than both austin powers films , but it 's also one of the smarter , savvier spoofs to come along in some time .  </s> 	1.27298942154793	1.25559404634948
245	not only unfunny , but downright repellent .  </s> 	1.06982850290595	1.03658577836847
246	not since freddy got fingered has a major release been so painful to sit through .  </s> 	0.902194010292299	1.80499053252333
247	not since japanese filmmaker akira kurosawa 's ran have the savagery of combat and the specter of death been visualized with such operatic grandeur .  </s> 	1.48841345393241	1.39667608354803
248	no way i can believe this load of junk .  </s> 	1.02362972531913	1.25519818632048
249	of course , by more objective measurements it 's still quite bad .  </s> 	1.7983827441769	2.62637242716596
250	old-form moviemaking at its best .  </s> 	1.32490439350891	1.71429665567321
251	once ( kim ) begins to overplay the shock tactics and bait-and-tackle metaphors , you may decide it 's too high a price to pay for a shimmering picture postcard .  </s> 	2.12103892141558	1.98374031833823
252	one of creepiest , scariest movies to come along in a long , long time , easily rivaling blair witch or the others .  </s> 	1.77957074541901	2.62226655362083
253	one of the more intelligent children 's movies to hit theaters this year .  </s> 	1.52534849582587	1.97019233555129
254	one of the more irritating cartoons you will see this , or any , year .  </s> 	1.27281953636258	1.42865798744056
255	one of the smartest takes on singles culture i 've seen in a long time .  </s> 	1.60931538251826	1.87594950537573
256	on the whole , the movie lacks wit , feeling and believability to compensate for its incessant coarseness and banality .  </s> 	1.17083102246368	1.40439625685136
257	on this tricky topic , tadpole is very much a step in the right direction , with its blend of frankness , civility and compassion .  </s> 	0.853747336002424	1.26282773015238
258	or doing last year 's taxes with your ex-wife .  </s> 	1.59934602640712	2.03281390175959
259	outer-space buffs might love this film , but others will find its pleasures intermittent .  </s> 	0.783694749437906	3.91329636150848
260	overall very good for what it 's trying to do .  </s> 	1.27612337104122	1.39116513200348
261	pacino is brilliant as the sleep-deprived dormer , his increasing weariness as much existential as it is physical .  </s> 	0.79459688383013	2.11368182527436
262	paid in full is so stale , in fact , that its most vibrant scene is one that uses clips from brian de palma 's scarface .  </s> 	1.29228285871124	2.11885369067817
263	partway through watching this saccharine , easter-egg-colored concoction , you realize that it is made up of three episodes of a rejected tv show .  </s> 	1.80144391327503	1.45749856415284
264	perceptive in its vision of nascent industrialized world politics as a new art form , but far too clunky , didactic and saddled with scenes that seem simply an ill fit for this movie .  </s> 	0.908541538726132	1.24092969874783
265	... plays like somebody spliced random moments of a chris rock routine into what is otherwise a cliche-riddled but self-serious spy thriller .  </s> 	1.35994203366337	2.38233208767292
266	portentous and pretentious , the weight of water is appropriately titled , given the heavy-handedness of it drama .  </s> 	1.17132889871697	2.40855592034871
267	pumpkin means to be an outrageous dark satire on fraternity life , but its ambitions far exceed the abilities of writer adam larson broder and his co-director , tony r. abrams , in their feature debut .  </s> 	1.47430423908481	4.86100475677457
268	pumpkin takes an admirable look at the hypocrisy of political correctness , but it does so with such an uneven tone that you never know when humor ends and tragedy begins .  </s> 	1.91854708287333	2.41625622138408
269	rarely has leukemia looked so shimmering and benign .  </s> 	1.7320657767376	1.93524829270129
270	rarely has so much money delivered so little entertainment .  </s> 	1.51380434798825	2.06934461833596
271	reign of fire looks as if it was made without much thought -- and is best watched that way .  </s> 	1.6843187586382	4.18975140254617
272	sacrifices the value of its wealth of archival foot-age with its less-than-objective stance .  </s> 	1.33397218324557	1.5493073602314
273	sade is an engaging look at the controversial eponymous and fiercely atheistic hero .  </s> 	1.3668509462384	1.46447497246699
274	sam mendes has become valedictorian at the school for soft landings and easy ways out .  </s> 	2.36871353720662	4.62012344476132
275	schaeffer has to find some hook on which to hang his persistently useless movies , and it might as well be the resuscitation of the middle-aged character .  </s> 	1.11346780291921	1.27162545760207
276	scooby dooby doo / and shaggy too / you both look and sound great .  </s> 	1.56111561788476	2.84872539020224
277	scores no points for originality , wit , or intelligence .  </s> 	0.886214877154026	1.64556196368415
278	seldom has a movie so closely matched the spirit of a man and his work .  </s> 	1.68108195811736	1.86185746692389
279	slapstick buffoonery can tickle many a preschooler 's fancy , but when it costs a family of four about $ 40 to see a film in theaters , why spend money on a dog like this when you can rent a pedigree instead ?  </s> 	1.58435136625721	1.01098163150964
280	smart , provocative and blisteringly funny .  </s> 	1.02672684831909	0.957615589675845
281	so devoid of any kind of intelligible story that it makes films like xxx and collateral damage seem like thoughtful treatises  </s> 	0.87724030091828	1.42538196606556
282	so , too , is this comedy about mild culture clashing in today 's new delhi .  </s> 	3.76242951895699	4.9219215454148
283	stealing harvard aspires to comedic grand larceny but stands convicted of nothing more than petty theft of your time .  </s> 	0.866514246873254	1.92315511500421
284	stealing harvard is evidence that the farrelly bros. -- peter and bobby -- and their brand of screen comedy are wheezing to an end , along with green 's half-hearted movie career .  </s> 	0.809952268446161	2.0344600573481
285	suffers from the lack of a compelling or comprehensible narrative .  </s> 	0.811188031023118	0.930942873278144
286	taylor appears to have blown his entire budget on soundtrack rights and had nothing left over for jokes .  </s> 	0.925798730673105	1.44030785634393
287	thanks to scott 's charismatic roger and eisenberg 's sweet nephew , roger dodger is one of the most compelling variations on in the company of men .  </s> 	1.00731658513586	1.20781246994181
288	that dogged good will of the parents and ` vain ' jia 's defoliation of ego , make the film touching despite some doldrums .  </s> 	1.83868942811441	1.53147354295315
289	that is a compliment to kuras and miller .  </s> 	1.3930946320923	1.62982048263863
290	that 's pure pr hype .  </s> 	1.49594611240761	2.26804346303646
291	the acting , costumes , music , cinematography and sound are all astounding given the production 's austere locales .  </s> 	1.33113660161811	1.71617635630263
292	the action switches between past and present , but the material link is too tenuous to anchor the emotional connections that purport to span a 125-year divide .  </s> 	2.59190316968559	1.5852203919412
293	the band 's courage in the face of official repression is inspiring , especially for aging hippies ( this one included ) .  </s> 	0.943413928687622	1.62284321889036
294	the best film about baseball to hit theaters since field of dreams .  </s> 	1.05325437722668	1.32551699377855
295	the best revenge may just be living well because this film , unlike other dumas adaptations , is far more likened to a treasure than a lengthy jail sentence .  </s> 	1.87942467740778	3.62215775304306
296	the best that can be said about the work here of scottish director ritchie ... is that he obviously does n't have his heart in it .  </s> 	1.30728205115786	3.46015807989651
297	the character of zigzag is not sufficiently developed to support a film constructed around him .  </s> 	2.32344834432595	1.78759571606813
298	the chateau cleverly probes the cross-cultural differences between gauls and yanks .  </s> 	1.73845406083707	1.78348348322724
299	the cold turkey would 've been a far better title .  </s> 	0.751118120500173	1.51628023837771
300	the continued good chemistry between carmen and juni is what keeps this slightly disappointing sequel going , with enough amusing banter -- blessedly curse-free -- to keep both kids and parents entertained .  </s> 	1.29082113822295	1.0057891756515
301	the draw ( for `` big bad love '' ) is a solid performance by arliss howard .  </s> 	0.847573194071218	2.01774466941308
302	the emotions are raw and will strike a nerve with anyone who 's ever had family trauma .  </s> 	1.23614320598811	1.07957589458279
303	the end result is a film that 's neither .  </s> 	1.71799227633269	2.96599930315153
304	the entire movie is about a boring , sad man being boring and sad .  </s> 	1.30506110437182	1.39246856936268
305	the film flat lines when it should peak and is more missed opportunity and trifle than dark , decadent truffle .  </s> 	0.821595232072853	0.996788868151706
306	the film is quiet , threatening and unforgettable .  </s> 	1.37524746320777	1.55772278683629
307	the film may appear naked in its narrative form ... but it goes deeper than that , to fundamental choices that include the complexity of the catholic doctrine  </s> 	1.23798988222006	2.72977351177924
308	the film 's performances are thrilling .  </s> 	1.61083741900731	1.59345351326147
309	... the film suffers from a lack of humor ( something needed to balance out the violence ) ...  </s> 	1.46704275356769	1.1488054484796
310	the film tries too hard to be funny and tries too hard to be hip .  </s> 	1.09982157751814	0.972739247016758
311	the film tunes into a grief that could lead a man across centuries .  </s> 	1.26628951082987	1.68929837337888
312	the format gets used best ... to capture the dizzying heights achieved by motocross and bmx riders , whose balletic hotdogging occasionally ends in bone-crushing screwups .  </s> 	0.887415887667242	3.45747530886382
313	the heavy-handed film is almost laughable as a consequence .  </s> 	1.02005165706809	1.66119420940481
314	the humor is forced and heavy-handed , and occasionally simply unpleasant .  </s> 	1.21026699166215	1.17889171852176
315	the iditarod lasts for days - this just felt like it did .  </s> 	2.26297757633913	3.28743809467297
316	thekids will probably stay amused at the kaleidoscope of big , colorful characters .  </s> 	1.41324258439413	2.35358649329489
317	the lower your expectations , the more you 'll enjoy it .  </s> 	1.59060924583553	1.95857829094715
318	the mesmerizing performances of the leads keep the film grounded and keep the audience riveted .  </s> 	0.854622607288308	0.940886032759212
319	the most hopelessly monotonous film of the year , noteworthy only for the gimmick of being filmed as a single unbroken 87-minute take .  </s> 	1.46411539026453	1.32115151677368
320	the movie achieves as great an impact by keeping these thoughts hidden as ... ( quills ) did by showing them .  </s> 	1.27124724365234	2.19157665797229
321	the movie fails to live up to the sum of its parts .  </s> 	1.24466737258565	1.21047097745646
322	the movie is beautiful to behold and engages one in a sense of epic struggle -- inner and outer -- that 's all too rare in hollywood 's hastier productions .  </s> 	0.856867333670816	1.10913565964695
323	... the movie is just a plain old monster .  </s> 	1.34497684277598	1.81132640450569
324	the movie is what happens when you blow up small potatoes to 10 times their natural size , and it ai n't pretty .  </s> 	1.67945725356136	1.48200433925304
325	the movie 's accumulated force still feels like an ugly knot tightening in your stomach .  </s> 	1.87634327586712	2.00300397265661
326	the movie 's relatively simple plot and uncomplicated morality play well with the affable cast .  </s> 	2.73554287337471	1.82173877994149
327	the movie understands like few others how the depth and breadth of emotional intimacy give the physical act all of its meaning and most of its pleasure .  </s> 	0.796326249346906	1.19218692910245
328	the primitive force of this film seems to bubble up from the vast collective memory of the combatants .  </s> 	1.30010573838787	3.11501970840788
329	there are simply too many ideas floating around -- part farce , part sliding doors , part pop video -- and yet failing to exploit them .  </s> 	1.30060783164987	1.39362291045019
330	there has always been something likable about the marquis de sade .  </s> 	1.20350250894992	2.13966299499685
331	there is a fabric of complex ideas here , and feelings that profoundly deepen them .  </s> 	1.29264681481117	1.85029594769095
332	there is no pleasure in watching a child suffer .  </s> 	1.67739227452867	1.44280714843224
333	there is nothing outstanding about this film , but it is good enough and will likely be appreciated most by sailors and folks who know their way around a submarine .  </s> 	1.79873751458635	1.54714485302283
334	there is n't nearly enough fun here , despite the presence of some appealing ingredients .  </s> 	1.48349064547349	1.73531492525075
335	there ought to be a directing license , so that ed burns can have his revoked .  </s> 	1.04239119071891	1.17562490368178
336	there seems to be no clear path as to where the story 's going , or how long it 's going to take to get there .  </s> 	1.52043405995747	1.93710027329575
337	there 's ... tremendous energy from the cast , a sense of playfulness and excitement that seems appropriate .  </s> 	1.15204510994509	1.8776574685301
338	the script kicks in , and mr. hartley 's distended pace and foot-dragging rhythms follow .  </s> 	2.57291420586143	2.78262930993248
339	the second coming of harry potter is a film far superior to its predecessor .  </s> 	2.31749035279164	1.81601468521777
340	the socio-histo-political treatise is told in earnest strides ... ( and ) personal illusion is deconstructed with poignancy .  </s> 	0.876982507438494	1.97160081416231
341	the son 's room is a triumph of gentility that earns its moments of pathos .  </s> 	0.981090999553809	1.50563062735461
342	the special effects and many scenes of weightlessness look as good or better than in the original , while the oscar-winning sound and james horner 's rousing score make good use of the hefty audio system .  </s> 	1.58138431465993	1.34209346456952
343	the story and structure are well-honed .  </s> 	2.14509978928483	1.73980891755775
344	the subtle strength of `` elling '' is that it never loses touch with the reality of the grim situation .  </s> 	0.986044513147398	1.36186647289595
345	the talented and clever robert rodriguez perhaps put a little too much heart into his first film and did n't reserve enough for his second .  </s> 	0.89997593773017	4.47274566261203
346	the tale of tok ( andy lau ) , a sleek sociopath on the trail of o ( takashi sorimachi ) , the most legendary of asian hitmen , is too scattershot to take hold .  </s> 	2.87665120106869	1.76478401374562
347	`` the time machine '' is a movie that has no interest in itself .  </s> 	2.63935556363817	3.18639552121777
348	the title not only describes its main characters , but the lazy people behind the camera as well .  </s> 	2.3917013897369	1.87914605620432
349	the very definition of the ` small ' movie , but it is a good stepping stone for director sprecher .  </s> 	2.98357919762784	2.50367734043197
350	the volatile dynamics of female friendship is the subject of this unhurried , low-key film that is so off-hollywood that it seems positively french in its rhythms and resonance .  </s> 	1.25068697505946	3.19283752948909
351	the weight of the piece , the unerring professionalism of the chilly production , and the fascination embedded in the lurid topic prove recommendation enough .  </s> 	0.88856496350675	1.57280344873194
352	the wild thornberrys movie is a jolly surprise .  </s> 	1.29465061066291	2.09675612555648
353	the x potion gives the quickly named blossom , bubbles and buttercup supernatural powers that include extraordinary strength and laser-beam eyes , which unfortunately do n't enable them to discern flimsy screenplays .  </s> 	2.24938967230457	1.68800278266955
354	this illuminating documentary transcends our preconceived vision of the holy land and its inhabitants , revealing the human complexities beneath .  </s> 	0.806971249202178	1.16436588771196
355	this is a story of two misfits who do n't stand a chance alone , but together they are magnificent .  </s> 	2.3117825378582	1.47678353336787
